{
  "$schema": "https://json-schema.org/draft/2020-12/schema",
  "$id": "https://qwuille.github.io/replicazeron_webhid/profiles/profile.schema.json",
  "title": "Replicazeron layout profile",
  "type": "object",
  "required": ["format", "version", "name", "title", "author", "description", "joystickMode", "keycodes"],
  "properties": {
    "format": { "const": "replicazeron-layout-profile" },
    "version": { "const": 1 },
    "name": { "type": "string", "minLength": 1 },
    "title": { "type": "string", "minLength": 1, "pattern": "^[ -~]+$", "description": "OLED title; WebHID limits the encoded value to 13 printable ASCII bytes." },
    "author": { "type": "string" },
    "game": { "type": "string" },
    "description": { "type": "string" },
    "systemLayer": { "type": "boolean", "description": "True for an exported Settings tool-layer profile." },
    "joystickMode": { "type": "integer", "minimum": 0, "maximum": 3, "description": "0 HID joystick, 1 WASD, 2 WASD + Shift, 3 RP2040 XInput + keyboard keycodes." },
    "oledDisplay": { "type": "integer", "minimum": 0, "maximum": 4, "description": "Per-layout OLED design: Input, Macro, Game, Combined, or Minimal." },
    "keycodes": {
      "type": "array",
      "minItems": 30,
      "maxItems": 30,
      "items": {
        "oneOf": [
          { "type": "string", "pattern": "^0x[0-9A-Fa-f]{1,4}$" },
          { "type": "integer", "minimum": 0, "maximum": 65535 },
          { "type": "null" }
        ]
      }
    }
  },
  "additionalProperties": true
}
